[
    { "name": "Agent", "purpose": "Spawn a subagent with its own context window (forks, agent-team teammates)", "permission": "no", "status": "active", "renamedFrom": "Task", "note": "Formerly the Task tool (CHANGELOG language switch ~2.1.7x); the removed TeamCreate/TeamDelete (v2.1.178) are replaced by spawning teammates via the Agent name parameter; the resume parameter was removed v2.1.77 in favour of SendMessage({to})", "source": "tools-reference.md Z.15; CHANGELOG.md Z.445,2554" },
    { "name": "Artifact", "purpose": "Publish HTML/MD as a private claude.ai page", "permission": "yes", "status": "active", "note": "Anthropic plans only (Pro/Max/Team/Enterprise)", "source": "tools-reference.md Z.16" },
    { "name": "AskUserQuestion", "purpose": "Multiple-choice question back to the user", "permission": "no", "status": "active", "note": "timeout behaviour configurable from v2.1.200", "source": "tools-reference.md Z.17" },
    { "name": "Bash", "purpose": "Run shell commands", "permission": "yes", "status": "active", "source": "tools-reference.md Z.18" },
    { "name": "CronCreate", "purpose": "Schedule session-internal recurring/one-off prompts", "permission": "no", "status": "active", "source": "tools-reference.md Z.19" },
    { "name": "CronDelete", "purpose": "Delete a scheduled task by id", "permission": "no", "status": "active", "source": "tools-reference.md Z.20" },
    { "name": "CronList", "purpose": "List the session's scheduled tasks", "permission": "no", "status": "active", "source": "tools-reference.md Z.21" },
    { "name": "Edit", "purpose": "Targeted file edits (exact string replacement)", "permission": "yes", "status": "active", "source": "tools-reference.md Z.22" },
    { "name": "EnterPlanMode", "purpose": "Switch into plan mode", "permission": "no", "status": "active", "source": "tools-reference.md Z.23" },
    { "name": "EnterWorktree", "purpose": "Create/enter an isolated git worktree", "permission": "no", "status": "active", "note": "nested repos supported from >=2.1.203", "source": "tools-reference.md Z.24" },
    { "name": "ExitPlanMode", "purpose": "Present the plan for approval and leave plan mode", "permission": "yes", "status": "active", "source": "tools-reference.md Z.25" },
    { "name": "ExitWorktree", "purpose": "Leave the worktree session", "permission": "no", "status": "active", "source": "tools-reference.md Z.26" },
    { "name": "Glob", "purpose": "Find files by pattern", "permission": "no", "status": "active", "source": "tools-reference.md Z.27" },
    { "name": "Grep", "purpose": "Search file contents (ripgrep)", "permission": "no", "status": "active", "source": "tools-reference.md Z.28" },
    { "name": "ListMcpResourcesTool", "purpose": "List resources of connected MCP servers", "permission": "no", "status": "active", "source": "tools-reference.md Z.29" },
    { "name": "LSP", "purpose": "Code intelligence via a language server (definitions, references, type errors)", "permission": "no", "status": "active", "note": "inactive without the code-intelligence plugin", "source": "tools-reference.md Z.30,Z.185" },
    { "name": "Monitor", "purpose": "Watch a background command/WebSocket and forward events to Claude", "permission": "yes", "status": "active", "note": "stable from v2.1.98; not on Bedrock/GCP/Foundry; off under DISABLE_TELEMETRY", "source": "tools-reference.md Z.31,Z.190,Z.207" },
    { "name": "NotebookEdit", "purpose": "Edit Jupyter notebook cells", "permission": "yes", "status": "active", "source": "tools-reference.md Z.32" },
    { "name": "PowerShell", "purpose": "Run PowerShell commands natively", "permission": "yes", "status": "active", "note": "Preview/experimental (opt-in on macOS/Linux)", "source": "tools-reference.md Z.33,Z.249-292" },
    { "name": "PushNotification", "purpose": "Desktop/phone push (remote control)", "permission": "no", "status": "active", "note": "Anthropic infra only (not Bedrock/GCP/Foundry)", "source": "tools-reference.md Z.34" },
    { "name": "Read", "purpose": "Read files (also images/PDF/ipynb)", "permission": "no", "status": "active", "source": "tools-reference.md Z.35" },
    { "name": "ReadMcpResourceTool", "purpose": "Read a single MCP resource by URI", "permission": "no", "status": "active", "source": "tools-reference.md Z.36" },
    { "name": "RemoteTrigger", "purpose": "Create/start routines on claude.ai (backs /schedule)", "permission": "no", "status": "active", "note": "Anthropic plans/infra only", "source": "tools-reference.md Z.37" },
    { "name": "ReportFindings", "purpose": "Report code-review findings in a structured form", "permission": "no", "status": "active", "note": "stable from v2.1.196", "source": "tools-reference.md Z.38" },
    { "name": "ScheduleWakeup", "purpose": "Schedule the next iteration of a self-paced /loop", "permission": "no", "status": "active", "note": "stop from v2.1.202; not on Bedrock/GCP/Foundry", "source": "tools-reference.md Z.39" },
    { "name": "SendMessage", "purpose": "Message an agent-team teammate / resume a subagent", "permission": "no", "status": "active", "note": "semantics changed v2.1.198/199; sole resume path since v2.1.77", "source": "tools-reference.md Z.40" },
    { "name": "SendUserFile", "purpose": "Send files to the user device (remote control/cloud)", "permission": "no", "status": "active", "note": "Anthropic infra only", "source": "tools-reference.md Z.41" },
    { "name": "ShareOnboardingGuide", "purpose": "Upload ONBOARDING.md and produce a share link", "permission": "yes", "status": "active", "note": "Anthropic plans only", "source": "tools-reference.md Z.42" },
    { "name": "Skill", "purpose": "Run a skill in the main conversation", "permission": "yes", "status": "active", "note": "skills add no new tool entries — they run through this one tool", "source": "tools-reference.md Z.43" },
    { "name": "TaskCreate", "purpose": "Create a task in the task list", "permission": "no", "status": "active", "source": "tools-reference.md Z.44" },
    { "name": "TaskGet", "purpose": "Read the details of a task", "permission": "no", "status": "active", "source": "tools-reference.md Z.45" },
    { "name": "TaskList", "purpose": "List all tasks with their status", "permission": "no", "status": "active", "source": "tools-reference.md Z.46" },
    { "name": "TaskOutput", "purpose": "Fetch the output of a background task", "permission": "no", "status": "deprecated", "replacedBy": "Read", "note": "deprecated in favour of Read on the output-file path since v2.1.83", "source": "tools-reference.md Z.47; CHANGELOG.md Z.2392" },
    { "name": "TaskStop", "purpose": "Stop a background task/teammate by id", "permission": "no", "status": "active", "source": "tools-reference.md Z.48" },
    { "name": "TaskUpdate", "purpose": "Change task status/dependencies, delete tasks", "permission": "no", "status": "active", "source": "tools-reference.md Z.49" },
    { "name": "TodoWrite", "purpose": "Session checklist (legacy)", "permission": "no", "status": "deprecated", "replacedBy": "TaskCreate,TaskGet,TaskList,TaskUpdate", "note": "default-disabled since v2.1.142 in favour of Task-CRUD (CLAUDE_CODE_ENABLE_TASKS=0 reactivates it)", "source": "tools-reference.md Z.50" },
    { "name": "ToolSearch", "purpose": "Search + load deferred tools (when tool search is on)", "permission": "no", "status": "active", "note": "conditional — only present with tool search enabled", "source": "tools-reference.md Z.51" },
    { "name": "WaitForMcpServers", "purpose": "Wait for still-connecting MCP servers", "permission": "no", "status": "active", "note": "conditional — only WITHOUT tool search (otherwise ToolSearch takes over)", "source": "tools-reference.md Z.52" },
    { "name": "WebFetch", "purpose": "Fetch a URL, convert to markdown, extract via a small model (lossy by design)", "permission": "yes", "status": "active", "source": "tools-reference.md Z.53,Z.310-312" },
    { "name": "WebSearch", "purpose": "Web search (titles + URLs, fetches no pages)", "permission": "yes", "status": "active", "source": "tools-reference.md Z.54" },
    { "name": "Workflow", "purpose": "Dynamic workflow: a script orchestrates many subagents", "permission": "yes", "status": "active", "source": "tools-reference.md Z.55" },
    { "name": "Write", "purpose": "Create/overwrite a file", "permission": "yes", "status": "active", "source": "tools-reference.md Z.56" }
]
